[
  {
    "id": "level_doctors_postgraduate_certificate",
    "programId": "program_pgcert_clinical_trichology_hair_restoration_medicine",
    "slug": "postgraduate-certificate",
    "title": "Postgraduate Certificate",
    "awardLabel": "Postgraduate Certificate",
    "sequence": 1,
    "status": "draft",
    "overview": "Doctor-facing postgraduate pathway covering scientific, diagnostic, and therapeutic foundations in hair restoration medicine.",
    "entryRequirements": [
      "Doctor, surgeon, or physician audience fit",
      "Appropriate medical background for postgraduate clinical study"
    ],
    "progressionRules": [
      "Completion remains subject to assessment and faculty review requirements"
    ],
    "completionRules": [
      "Complete required modules and assessments in good academic standing"
    ],
    "sectionIds": ["section_doctors_volume_1", "section_doctors_volume_2", "section_doctors_volume_3"],
    "moduleIds": [],
    "competencyIds": [
      "doctors_vol1_comp_introduction_scope",
      "doctors_vol1_comp_follicle_biology",
      "doctors_vol1_comp_molecular_hormonal",
      "doctors_vol1_comp_consultation_history",
      "doctors_vol2_comp_clinical_examination",
      "doctors_vol2_comp_trichoscopy",
      "doctors_vol2_comp_investigations_biopsy",
      "doctors_vol2_comp_male_aga",
      "doctors_vol2_comp_female_pattern",
      "doctors_vol3_comp_telogen_diffuse_shedding",
      "doctors_vol3_comp_alopecia_areata",
      "doctors_vol3_comp_shaft_breakage",
      "doctors_vol3_comp_cicatricial_principles",
      "doctors_vol3_comp_lymphocytic_cicatricial",
      "doctors_vol3_comp_neutrophilic_cicatricial",
      "doctors_vol3_comp_scalp_inflammatory_infectious"
    ],
    "certificateTemplateKey": "doctor-pgcert-certificate",
    "badgeTemplateKey": "doctor-pgcert-badge"
  }
]
